{
  "schema_version": "victoroff.program-registry.v1",
  "program_id": "victoroff",
  "governing_ux_rule": "complex governance underneath; simple actions on top",
  "authority": {
    "mode": "uncommissioned_synthetic_only",
    "real_bbnc_data_allowed": false,
    "real_bbnc_identity_allowed": false,
    "representation_allowed": false,
    "holds": [
      {
        "id": "victoroff-custody-hold",
        "source": "https://github.com/organvm/victoroff-os/issues/3",
        "blocks": [
          "organization_creation",
          "repository_transfer",
          "collaborator_changes",
          "github_app_installation",
          "remote_rewrite",
          "commercial_repository_creation"
        ]
      },
      {
        "id": "victoroff-production-hold",
        "source": "https://github.com/organvm/victoroff-os/issues/2",
        "blocks": [
          "dns_change",
          "production_promotion",
          "deployment_change",
          "infrastructure_transfer"
        ]
      }
    ]
  },
  "actions": [
    { "id": "start", "label": "Start" },
    { "id": "decide", "label": "Decide" },
    { "id": "build", "label": "Build" },
    { "id": "release", "label": "Release" },
    { "id": "find-rule", "label": "Find a Rule" },
    { "id": "see-status", "label": "See What's Happening" },
    { "id": "understand", "label": "Understand Victoroff" }
  ],
  "source_inputs": [
    {
      "id": "victoroff-brainstorm-20260722-tier-finance",
      "record": "program/sources/victoroff-brainstorm-20260722-tier-finance.v1.json",
      "disposition": "folded_with_authority_and_evidence_guards"
    }
  ],
  "product_extensions": [
    {
      "id": "economic-agency-tiers-v1",
      "program_id": "victoroff-os",
      "state": "accepted_product_direction",
      "contract": "program/product/economic-agency-tiers.v1.json",
      "owner": "victoroff-progression",
      "dependencies": ["control-main-green"],
      "predicate": "registry validation proves five ordered tiers, measurable unlocks, and non-guarantee language",
      "receipt_target": "github://organvm/victoroff-os/program/product/economic-agency-tiers.v1.json"
    },
    {
      "id": "embedded-finance-reservation-v1",
      "program_id": "victoroff-os",
      "state": "future_regulated_layer",
      "contract": "program/product/embedded-finance-reservation.v1.json",
      "owner": "victoroff-finance-architecture",
      "dependencies": ["economic-agency-tiers-v1", "financial-product-authorized"],
      "predicate": "financial implementation remains disabled until product, legal, compliance, partner, security, and claims gates have receipts",
      "receipt_target": "github://organvm/victoroff-os/program/product/embedded-finance-reservation.v1.json"
    }
  ],
  "programs": [
    {
      "id": "victoroff-os",
      "name": "Victoroff OS",
      "repository": "organvm/victoroff-os",
      "visibility": "private",
      "state": "active_synthetic",
      "surfaces": [
        "apps/site",
        "apps/os",
        "services/api",
        "packages/governance",
        "packages/domain",
        "packages/progression",
        "packages/persistence",
        "packages/publication"
      ]
    },
    {
      "id": "shareholder-development",
      "name": "Shareholder Development Solution",
      "repository": "organvm/victoroff-os",
      "visibility": "private",
      "state": "public_safe_exemplar",
      "surfaces": [
        "apps/shareholder-demo",
        "apps/stewardship-demo",
        "packages/shareholder-development"
      ]
    },
    {
      "id": "victoroff-commercial",
      "name": "Victoroff Commercial",
      "repository": null,
      "visibility": "private",
      "state": "authority_held",
      "surfaces": []
    }
  ],
  "path_owners": [
    {
      "id": "control-plane",
      "owner": "victoroff-control-integrator",
      "patterns": [
        "AGENTS.md",
        ".github/**",
        "package.json",
        "pnpm-lock.yaml",
        "pnpm-workspace.yaml",
        "program/**",
        "scripts/control/**",
        "tests/control/**",
        "docs/program/**",
        "docs/continuations/**"
      ]
    },
    {
      "id": "public-site",
      "owner": "victoroff-site",
      "patterns": ["apps/site/**", "tests/e2e/**", "tests/a11y/**"]
    },
    {
      "id": "internal-os",
      "owner": "victoroff-os-app",
      "patterns": ["apps/os/**"]
    },
    {
      "id": "shareholder-demo",
      "owner": "shareholder-development",
      "patterns": ["apps/shareholder-demo/**", "apps/stewardship-demo/**"]
    },
    {
      "id": "api",
      "owner": "victoroff-api",
      "patterns": ["services/api/**"]
    },
    {
      "id": "governance",
      "owner": "victoroff-governance",
      "patterns": ["docs/governance/**", "packages/governance/**"]
    },
    {
      "id": "contracts",
      "owner": "victoroff-contracts",
      "patterns": ["packages/contracts/**"]
    },
    {
      "id": "domain",
      "owner": "victoroff-domain",
      "patterns": ["packages/domain/**"]
    },
    {
      "id": "persistence",
      "owner": "victoroff-persistence",
      "patterns": ["packages/persistence/**"]
    },
    {
      "id": "publication",
      "owner": "victoroff-publication",
      "patterns": ["packages/publication/**"]
    },
    {
      "id": "shareholder-development-package",
      "owner": "shareholder-development",
      "patterns": ["packages/shareholder-development/**"]
    },
    {
      "id": "progression",
      "owner": "victoroff-progression",
      "patterns": ["packages/progression/**"]
    },
    {
      "id": "finance-architecture",
      "owner": "victoroff-finance-architecture",
      "patterns": ["docs/finance/**"]
    }
  ],
  "gates": [
    {
      "id": "control-main-green",
      "state": "derive_live",
      "owner": "victoroff-control-integrator",
      "predicate": "node scripts/control/check-live-control-gate.mjs",
      "receipt_target": "github://organvm/victoroff-os/actions?branch=main&head=live&workflows=verify,CodeQL"
    },
    {
      "id": "authority-ratified",
      "state": "authority_held",
      "owner": "ratified-victoroff-principal",
      "predicate": "issues #2 and #3 contain mutually consistent release receipts",
      "receipt_target": "github://organvm/victoroff-os/issues/2+3"
    },
    {
      "id": "financial-product-authorized",
      "state": "human_product_gate",
      "owner": "ratified-victoroff-product-principal",
      "predicate": "a reviewed product decision plus legal, compliance, regulated-partner, security, privacy, and claims receipts authorize a bounded financial product",
      "receipt_target": "decision://victoroff/embedded-finance"
    }
  ],
  "delivery_graphs": [
    {
      "id": "bbnc-delivery-55-v1",
      "name": "Legacy BBNC Concept plus Phase 0-9 delivery graph",
      "program_id": "shareholder-development",
      "scope": "public_safe_synthetic_exemplar",
      "checkpoint_total": 55,
      "provisional_claim_total": 12,
      "claim_state": "provisional_pending_checkpoint_predicates",
      "source": "https://github.com/organvm/victoroff-os/pull/11",
      "phases": [
        {
          "id": "concept",
          "name": "Working Victoroff proof",
          "owner": "victoroff-site",
          "allowed_paths": ["apps/site/**", "apps/stewardship-demo/**", "packages/**", "tests/**"],
          "dependencies": [],
          "predicate": "pnpm verify",
          "receipt_target": "github://organvm/victoroff-os/actions/runs/29922088547",
          "checkpoints": [
            { "id": "BBNC-CONCEPT-01", "title": "Black-and-white public pitch", "claim": "provisional_verified" },
            { "id": "BBNC-CONCEPT-02", "title": "Six public shareholder action journeys", "claim": "provisional_verified" },
            { "id": "BBNC-CONCEPT-03", "title": "Concentric product model", "claim": "provisional_verified" },
            { "id": "BBNC-CONCEPT-04", "title": "Synthetic Stewardship proof", "claim": "provisional_verified" },
            { "id": "BBNC-CONCEPT-05", "title": "Tested deployment and rollback concept", "claim": "provisional_verified" }
          ]
        },
        {
          "id": "phase-0",
          "name": "Authority, custody, and source integrity",
          "owner": "ratified-victoroff-principal",
          "allowed_paths": ["docs/governance/**"],
          "dependencies": ["concept", "authority-ratified"],
          "predicate": "signed authority packet checksum and precedence validation",
          "receipt_target": "authority://victoroff/phase-0",
          "checkpoints": [
            { "id": "BBNC-P0-01", "title": "Signed authority charter", "claim": "authority_held" },
            { "id": "BBNC-P0-02", "title": "Named owners and change authority", "claim": "authority_held" },
            { "id": "BBNC-P0-03", "title": "Data, product, and IP split", "claim": "authority_held" },
            { "id": "BBNC-P0-04", "title": "Acceptance and change control", "claim": "authority_held" },
            { "id": "BBNC-P0-05", "title": "Client-controlled delivery accounts", "claim": "authority_held" }
          ]
        },
        {
          "id": "phase-1",
          "name": "Discovery and adoption definition",
          "owner": "victoroff-discovery",
          "allowed_paths": ["docs/research/**", "packages/fixtures/**"],
          "dependencies": ["phase-0"],
          "predicate": "approved discovery charter and measurable adoption outcomes",
          "receipt_target": "decision://victoroff/phase-1",
          "checkpoints": [
            { "id": "BBNC-P1-01", "title": "Public task baseline and six sourced journeys", "claim": "provisional_verified" },
            { "id": "BBNC-P1-02", "title": "Authority and role inventory", "claim": "open" },
            { "id": "BBNC-P1-03", "title": "Service, content, data, and integration inventory", "claim": "open" },